{
  "schema_version": 1,
  "plan_id": "plan-cloverthe.ai-20260424-123456",
  "active_version": 2,
  "superseded_versions": [1],
  "node_states": {
    "node-1": {
      "status": "completed",
      "task_id": "task-coder-20260424-124712",
      "started_at": "2026-04-24T12:47:12Z",
      "completed_at": "2026-04-24T12:51:48Z",
      "result_path": "agents/researcher-01/done/task-coder-20260424-124712.result.json",
      "retries": 0
    },
    "node-2": {
      "status": "pending",
      "task_id": null,
      "started_at": null,
      "completed_at": null,
      "result_path": null,
      "retries": 0
    }
  },
  "merge_hold": true,
  "updated_at": "2026-04-24T12:52:00Z"
}
